id,title,artist_name,artist_uri,genres,image,last_fm_uri
2257ace8-89ed-4703-9a17-52524f69a851,"Je Me Souviens, Je Me Rappelle",Daniel Darc,https://www.last.fm/music/Daniel+Darc,"chanson francaise, french, Ballad, hexagonal, chanson",,"https://www.last.fm/music/Daniel+Darc/_/Je+Me+Souviens,+Je+Me+Rappelle"
4c337d3b-c91a-400a-a966-d37ef8514116,Pile ou face,Corynne Charby,https://www.last.fm/music/Corynne+Charby,"Unimaginable Brilliance, 80s, 2009, sexy, france",,https://www.last.fm/music/Corynne+Charby/_/Pile+ou+face
01679c9b-c552-3523-a10f-dea5fb4531f4,Flowers In December,Mazzy Star,https://www.last.fm/music/Mazzy+Star,"female vocalists, dream pop, indie, alternative, acoustic",,https://www.last.fm/music/Mazzy+Star/_/Flowers+In+December
42292278-8947-3627-bd41-ed801e842c6d,The End,PJ Harvey,https://www.last.fm/music/PJ+Harvey,"rock, instrumental, alternative, female vocalists, singer-songwriter",,https://www.last.fm/music/PJ+Harvey/_/The+End
9c2230af-5089-405c-be34-6ab24d7fc49d,Regal,NoName,https://www.last.fm/music/NoName,"Hip-Hop, hip hop, rap, fip, chicago",,https://www.last.fm/music/NoName/_/Regal
64ffe717-6b10-393a-9e7e-78ca91ff0ba4,"Texas Ain't So Bad, Really",Hammerbox,https://www.last.fm/music/Hammerbox,,,"https://www.last.fm/music/Hammerbox/_/Texas+Ain%27t+So+Bad,+Really"
67b9908e-303c-4306-881d-868d7d1163cf,Boulevard of Broken Dreams,Green Day,https://www.last.fm/music/Green+Day,"rock, punk rock, green day, punk, alternative",,https://www.last.fm/music/Green+Day/_/Boulevard+of+Broken+Dreams
0b5bf9ed-6748-45e8-b85e-f05a4af549d5,Fake It,Seether,https://www.last.fm/music/Seether,"rock, alternative rock, post-grunge, hard rock, Grunge",,https://www.last.fm/music/Seether/_/Fake+It
0302b133-c2d2-4d5d-82ef-fd997b350788,Anthem Part Two,blink-182,https://www.last.fm/music/blink-182,"punk rock, pop punk, punk, rock, alternative",,https://www.last.fm/music/blink-182/_/Anthem+Part+Two
7ece455d-792a-33fa-a582-f169097a36ae,Le festin,Camille,https://www.last.fm/music/Camille,"Soundtrack, french, Disney, ratatouille, female vocalists",,https://www.last.fm/music/Camille/_/Le+festin
0d2e329d-ce98-3840-a07e-d332527d108a,Jardin d'hiver,Keren Ann,https://www.last.fm/music/Keren+Ann,"french, female vocalists, chanson francaise, chanson, chillout",,https://www.last.fm/music/Keren+Ann/_/Jardin+d%27hiver
6aa66c4a-2bb0-322f-93df-96e55bc3708c,Les Eaux de mars,Stacey Kent,https://www.last.fm/music/Stacey+Kent,"lizvelrene2010, jazz, Bossa Nova, french, female vocal",,https://www.last.fm/music/Stacey+Kent/_/Les+Eaux+de+mars
c7cb3c5a-f225-4ea8-b8c3-189afb3410ad,Mots justes,Angèle,https://www.last.fm/music/Ang%C3%A8le,"french, Belgium, belgian",,https://www.last.fm/music/Ang%C3%A8le/_/Mots+justes
9c36ddbf-20f4-46e1-ba20-cc70551a3ba6,Toutes les machines ont un cœur,Maëlle,https://www.last.fm/music/Ma%C3%ABlle,"french, pop, female vocalists, WSC - GenZ 01 - THE FINAL",,https://www.last.fm/music/Ma%C3%ABlle/_/Toutes+les+machines+ont+un+c%C5%93ur
23043539-9046-4f91-8f59-8c5ed4408b11,LA VALSE DES TROTTOIRS,Choses Sauvages,https://www.last.fm/music/Choses+Sauvages,fip,,https://www.last.fm/music/Choses+Sauvages/_/LA+VALSE+DES+TROTTOIRS
f6921747-dc3e-454d-baa9-7b9605b7fb12,Let's Get It Started,Black Eyed Peas,https://www.last.fm/music/Black+Eyed+Peas,"Hip-Hop, dance, pop, black eyed peas, hip hop",,https://www.last.fm/music/Black+Eyed+Peas/_/Let%27s+Get+It+Started
056cf3a2-d6d5-347f-96fa-21885390eba3,Party All the Time,Black Eyed Peas,https://www.last.fm/music/Black+Eyed+Peas,"black eyed peas, dance, party, Hip-Hop, 2009",,https://www.last.fm/music/Black+Eyed+Peas/_/Party+All+the+Time
246f8a40-2c19-4ffb-bf3a-2e63935f9c88,Without Me,Eminem,https://www.last.fm/music/Eminem,"rap, Hip-Hop, Eminem, hip hop, 00s",,https://www.last.fm/music/Eminem/_/Without+Me
21ba6df4-1777-466f-b73f-dba00624a1d3,Empire State Of Mind,Jay-Z,https://www.last.fm/music/Jay-Z,"Hip-Hop, rap, hip hop, jay-z, Alicia Keys",,https://www.last.fm/music/Jay-Z/_/Empire+State+Of+Mind
05213d52-3a8c-3ece-8bc0-b1be70d34aea,Play,Jennifer Lopez,https://www.last.fm/music/Jennifer+Lopez,"pop, dance, rnb, jennifer lopez, female vocalists",,https://www.last.fm/music/Jennifer+Lopez/_/Play
701ad166-9bbe-3dd2-bb38-a3e802d9cdf9,What a Girl Wants,Christina Aguilera,https://www.last.fm/music/Christina+Aguilera,"pop, Christina Aguilera, 90s, female vocalists, rnb",,https://www.last.fm/music/Christina+Aguilera/_/What+a+Girl+Wants
35c7bfc2-054b-3cef-8ff0-79841765c1da,Corona,Minutemen,https://www.last.fm/music/Minutemen,"punk, 80s, jackass, alternative, post-punk",,https://www.last.fm/music/Minutemen/_/Corona
0157a06e-1b67-42b5-90e6-e0110a7dbb66,Superman,Goldfinger,https://www.last.fm/music/Goldfinger,"ska, ska punk, punk, punk rock, rock",,https://www.last.fm/music/Goldfinger/_/Superman
28451744-fce6-4c45-a0ae-7590ceac6b21,Take on me,Reel Big Fish,https://www.last.fm/music/Reel+Big+Fish,"ska, cover, ska punk, covers, punk",,https://www.last.fm/music/Reel+Big+Fish/_/Take+on+me
230957ba-1c9e-45b4-9d7e-ad8d0325eb5f,Paris,L'Impératrice,https://www.last.fm/music/L%27Imp%C3%A9ratrice,,,https://www.last.fm/music/L%27Imp%C3%A9ratrice/_/Paris
154dff56-dc11-4151-80e6-584d415b731d,Mr. Brightside,The Killers,https://www.last.fm/music/The+Killers,"rock, indie, indie rock, alternative, alternative rock",,https://www.last.fm/music/The+Killers/_/Mr.+Brightside
1b769809-d2a1-3465-a4d1-b69a99b705b1,Get Naked,Methods Of Mayhem,https://www.last.fm/music/Methods+Of+Mayhem,"rock, rapcore, alternative, metal, Hip-Hop",,https://www.last.fm/music/Methods+Of+Mayhem/_/Get+Naked
57ddb1c0-6e7a-49cd-9e92-059286f1c9be,Paralyzer,Finger Eleven,https://www.last.fm/music/Finger+Eleven,"rock, alternative rock, alternative, finger eleven, hard rock",,https://www.last.fm/music/Finger+Eleven/_/Paralyzer
26e7470b-e2e4-34ed-9559-22a2c75e291f,Snot,Snot,https://www.last.fm/music/Snot,"metal, hardcore, Nu Metal, Snot, metalcore",,https://www.last.fm/music/Snot/_/Snot
bf212788-fe39-493c-92c1-edb29ea1c2f0,Thomas,A Perfect Circle,https://www.last.fm/music/A+Perfect+Circle,"alternative rock, Progressive rock, A Perfect Circle, rock, alternative",,https://www.last.fm/music/A+Perfect+Circle/_/Thomas
6567c563-3d9b-4ae5-9941-f8d24a99336e,Thinking of You,A Perfect Circle,https://www.last.fm/music/A+Perfect+Circle,"alternative rock, rock, Progressive rock, alternative, A Perfect Circle",,https://www.last.fm/music/A+Perfect+Circle/_/Thinking+of+You
30c5cd25-ac4f-33f2-85b4-440c0ab1a639,Lucky You,Deftones,https://www.last.fm/music/Deftones,"alternative rock, alternative, metal, trip-hop, electronic",,https://www.last.fm/music/Deftones/_/Lucky+You
1327718e-021f-45bf-9175-b3c9ed3a8baf,Pink Maggit,Deftones,https://www.last.fm/music/Deftones,"metal, Nu Metal, rock, alternative, alternative metal",,https://www.last.fm/music/Deftones/_/Pink+Maggit
7c928a42-57f9-493a-8e59-7795cb7f050f,With Arms Wide Open,Creed,https://www.last.fm/music/Creed,"rock, alternative rock, Creed, alternative, Grunge",,https://www.last.fm/music/Creed/_/With+Arms+Wide+Open
4b3a1c48-b1a4-3cb4-b6e9-3cd4a9c6182a,Waiting Room,Fugazi,https://www.last.fm/music/Fugazi,"post-hardcore, punk, anthem, alternative, alternative rock",,https://www.last.fm/music/Fugazi/_/Waiting+Room
59851cf1-4bb0-48e5-a523-2e2207d297d1,Anenome,The Brian Jonestown Massacre,https://www.last.fm/music/The+Brian+Jonestown+Massacre,"psychedelic, Psychedelic Rock, indie rock, trippy, indie",,https://www.last.fm/music/The+Brian+Jonestown+Massacre/_/Anenome
52b178a5-1ba5-4052-8072-a88feb7107ec,You Showed Me,The Lightning Seeds,https://www.last.fm/music/The+Lightning+Seeds,"britpop, 90s, cover, rock, indie",,https://www.last.fm/music/The+Lightning+Seeds/_/You+Showed+Me
8809db06-8378-3d10-901a-0515319925e6,Passion,Nightmares on Wax,https://www.last.fm/music/Nightmares+on+Wax,"chillout, downtempo, trip-hop, lounge, electronic",,https://www.last.fm/music/Nightmares+on+Wax/_/Passion
05265696-02f4-34ea-ad63-f355b31456af,Ugly,The Exies,https://www.last.fm/music/The+Exies,"rock, alternative rock, alternative, indie, post-grunge",,https://www.last.fm/music/The+Exies/_/Ugly
107c2b08-3e26-3008-808d-25d5b1ac0a93,Lui e lei,Piero Umiliani,https://www.last.fm/music/Piero+Umiliani,"secretagent, somafm, Soundtrack, jazz, Library",,https://www.last.fm/music/Piero+Umiliani/_/Lui+e+lei
aa5fb7f1-8bd1-4dac-b40f-847d6ed2a0eb,The Real Slim Shady,Eminem,https://www.last.fm/music/Eminem,"rap, Hip-Hop, Eminem, hip hop, 00s",,https://www.last.fm/music/Eminem/_/The+Real+Slim+Shady
466bc42f-1b5c-429b-ab6e-100cbb913851,Straight Outta Compton,N.W.A,https://www.last.fm/music/N.W.A,"Gangsta Rap, rap, Hip-Hop, West Coast Rap, hip hop",,https://www.last.fm/music/N.W.A/_/Straight+Outta+Compton
e0fbf697-64d4-4b29-b752-fb88b47c624c,Standing Outside a Broken Phone Booth With Money in My Hand,Primitive Radio Gods,https://www.last.fm/music/Primitive+Radio+Gods,"90s, alternative, alternative rock, rock, melancholy",,https://www.last.fm/music/Primitive+Radio+Gods/_/Standing+Outside+a+Broken+Phone+Booth+With+Money+in+My+Hand
f2215158-fc73-4fa0-a287-1d589ac755f1,My Name Is,Eminem,https://www.last.fm/music/Eminem,"rap, Hip-Hop, Eminem, hip hop, 90s",,https://www.last.fm/music/Eminem/_/My+Name+Is
1aaf1612-50b9-3e22-af74-2c676522332c,The hardest,Gasoline,https://www.last.fm/music/Gasoline,"electronic, trip-hop, alternative, abstract hip-hop, recos",,https://www.last.fm/music/Gasoline/_/The+hardest
9c2cf3ee-ea81-4192-b626-12791c70fff5,Kryptonite,3 Doors Down,https://www.last.fm/music/3+Doors+Down,"rock, alternative rock, 3 Doors Down, alternative, hard rock",,https://www.last.fm/music/3+Doors+Down/_/Kryptonite
09e2d89c-4506-46ce-a104-a97f91831f1a,To Hell With Good Intentions,mclusky,https://www.last.fm/music/mclusky,"indie rock, rock, alternative, alternative rock, noise rock",,https://www.last.fm/music/mclusky/_/To+Hell+With+Good+Intentions
13b71c5f-2873-36e5-8a81-bebdf306619d,Radio,Alkaline Trio,https://www.last.fm/music/Alkaline+Trio,"punk, punk rock, rock, alternative, emo",,https://www.last.fm/music/Alkaline+Trio/_/Radio
9b869922-b600-4843-966a-e2075f822582,Shimmer,Fuel,https://www.last.fm/music/Fuel,"alternative rock, rock, 90s, alternative, fuel",,https://www.last.fm/music/Fuel/_/Shimmer
6d565b66-5d73-495d-a800-24faa9580bc0,She Hates Me,Puddle of Mudd,https://www.last.fm/music/Puddle+of+Mudd,"rock, alternative rock, Grunge, alternative, post-grunge",,https://www.last.fm/music/Puddle+of+Mudd/_/She+Hates+Me
1639624b-83ea-45b1-b2d0-e2866cb9ad07,Welcome to the Black Parade,My Chemical Romance,https://www.last.fm/music/My+Chemical+Romance,"rock, emo, alternative, punk rock, punk",,https://www.last.fm/music/My+Chemical+Romance/_/Welcome+to+the+Black+Parade
2ce53b24-1d0e-3d24-bbdd-8973cde1ad1b,Trippin',Kittie,https://www.last.fm/music/Kittie,"metal, Nu Metal, female vocalists, Female fronted metal, female vocals",,https://www.last.fm/music/Kittie/_/Trippin%27
8500068b-c11c-48f9-bbcd-3f1b61693304,MX,Deftones,https://www.last.fm/music/Deftones,"Nu Metal, metal, alternative metal, Deftones, alternative",,https://www.last.fm/music/Deftones/_/MX
3874f02e-a507-4927-896f-50f15e5e17fe,Pretty Fly (For a White Guy),The Offspring,https://www.last.fm/music/The+Offspring,"punk rock, rock, punk, alternative rock, alternative",,https://www.last.fm/music/The+Offspring/_/Pretty+Fly+(For+a+White+Guy)
027edd9a-d9ee-36f3-a3cf-ee22501a83b1,The Brilliant Dance,Dashboard Confessional,https://www.last.fm/music/Dashboard+Confessional,"emo, acoustic, dashboard confessional, rock, alternative",,https://www.last.fm/music/Dashboard+Confessional/_/The+Brilliant+Dance
874a8b38-36aa-4f4d-9f80-c2caa9deb691,Stolen,Dashboard Confessional,https://www.last.fm/music/Dashboard+Confessional,"alternative, emo, rock, indie, acoustic",,https://www.last.fm/music/Dashboard+Confessional/_/Stolen
090582be-e47c-4103-9b98-2f053a35c60b,Rickets,Deftones,https://www.last.fm/music/Deftones,"metal, Nu Metal, alternative metal, Deftones, rock",,https://www.last.fm/music/Deftones/_/Rickets
35fa6e20-3708-4fb5-82ce-b1ead3fb8e73,Around the Fur,Deftones,https://www.last.fm/music/Deftones,"metal, Nu Metal, Deftones, alternative metal, alternative rock",,https://www.last.fm/music/Deftones/_/Around+the+Fur
614c5e6e-9845-4989-a499-2405eae9a9b9,Blurry,Puddle of Mudd,https://www.last.fm/music/Puddle+of+Mudd,"rock, alternative rock, Grunge, alternative, post-grunge",,https://www.last.fm/music/Puddle+of+Mudd/_/Blurry
6a0f2ffe-5003-4195-8ac5-3e8cb155f4dd,"Randy, I Am The Liquor",Free Throw,https://www.last.fm/music/Free+Throw,,,"https://www.last.fm/music/Free+Throw/_/Randy,+I+Am+The+Liquor"
9266f109-61cf-457c-9fd5-ba886cabb2fe,The Corner's Dilemma,Free Throw,https://www.last.fm/music/Free+Throw,,,https://www.last.fm/music/Free+Throw/_/The+Corner%27s+Dilemma
02c95b34-d595-3928-87b4-c3c31675992b,Year as Lift,Rooftops,https://www.last.fm/music/Rooftops,math rock,,https://www.last.fm/music/Rooftops/_/Year+as+Lift
6bc837f0-4d4c-371e-bd89-e1ba4447c253,I Got a Man,Positive K,https://www.last.fm/music/Positive+K,"hip hop, 90s, old school, Hip-Hop, rap",,https://www.last.fm/music/Positive+K/_/I+Got+a+Man
054edf49-d177-4fd9-b681-84cf0d6a8a75,Way Out,J.J. Fad,https://www.last.fm/music/J.J.+Fad,,,https://www.last.fm/music/J.J.+Fad/_/Way+Out
6374d1aa-68d3-3089-89ea-20983e23c480,Tout C'Qui Nous Sépare,Jil Caplan,https://www.last.fm/music/Jil+Caplan,"french, 80s, female vocalists, eighties, chanson francaise",,https://www.last.fm/music/Jil+Caplan/_/Tout+C%27Qui+Nous+S%C3%A9pare
01489aff-536d-3385-8f60-9a4d030a3894,Plateau,Meat Puppets,https://www.last.fm/music/Meat+Puppets,"Grunge, alternative, alternative rock, rock, Meat Puppets",,https://www.last.fm/music/Meat+Puppets/_/Plateau
1ca856da-2011-4ad8-a989-e641b7183357,Forming,The Germs,https://www.last.fm/music/The+Germs,"punk, hardcore punk, punk rock, la punk, Cacophony",,https://www.last.fm/music/The+Germs/_/Forming
05128f08-1b5e-3205-bb06-5e6aa4dd9e20,Gangsta Bitches,Eve,https://www.last.fm/music/Eve,,,https://www.last.fm/music/Eve/_/Gangsta+Bitches
0194489a-6c56-46ea-9620-7dc588fa4648,Beat Your Heart Out,The Distillers,https://www.last.fm/music/The+Distillers,"punk, punk rock, female vocalists, rock, alternative",,https://www.last.fm/music/The+Distillers/_/Beat+Your+Heart+Out
16eb9e0c-5113-4233-a561-c7f759ca0cf2,This Could Be Anywhere,Dead Kennedys,https://www.last.fm/music/Dead+Kennedys,"punk, punk rock, political, hardcore punk, 80s",,https://www.last.fm/music/Dead+Kennedys/_/This+Could+Be+Anywhere
55bbd593-23a8-4be6-8971-5804f2de0945,Rose pink cadillac,Dope Lemon,https://www.last.fm/music/Dope+Lemon,"pop, psychedelic pop, psychedelic, fip, FM4",,https://www.last.fm/music/Dope+Lemon/_/Rose+pink+cadillac
0d07694d-66ff-32f9-bead-43f886f35989,Na Na Na (Na Na Na Na Na Na Na Na Na),My Chemical Romance,https://www.last.fm/music/My+Chemical+Romance,"punk rock, alternative, rock, punk, alternative rock",,https://www.last.fm/music/My+Chemical+Romance/_/Na+Na+Na+(Na+Na+Na+Na+Na+Na+Na+Na+Na)
add2d29a-624e-4953-aa2c-5c6511542ee1,Father Of Mine,Everclear,https://www.last.fm/music/Everclear,"90s, rock, alternative rock, alternative, Grunge",,https://www.last.fm/music/Everclear/_/Father+Of+Mine
c2fed0ce-3bb5-48b3-87f9-bc1bbc376c56,Lightning Crashes,Live,https://www.last.fm/music/Live,"rock, 90s, alternative rock, alternative, live",,https://www.last.fm/music/Live/_/Lightning+Crashes
3f9606c7-16ae-4174-ad03-a97265d041e0,We Still Party,DJ Quik,https://www.last.fm/music/DJ+Quik,"Hip-Hop, Gangsta Rap, West Coast Rap, G-funk, dj quik",,https://www.last.fm/music/DJ+Quik/_/We+Still+Party
12271e9a-ecb9-3b47-b6ef-9b4b03749adc,This Is How We Do,Big Tymers,https://www.last.fm/music/Big+Tymers,"rap, big tymers, Hip-Hop, Dirty South, New Orleans",,https://www.last.fm/music/Big+Tymers/_/This+Is+How+We+Do
2f57d8fb-c8ee-4615-8ede-2fef03aedd7e,Teddy Bear,G-Wiz,https://www.last.fm/music/G-Wiz,,,https://www.last.fm/music/G-Wiz/_/Teddy+Bear
18980144-73e6-4d3e-a79a-a68bbc400fd2,I Wanna Sex You Up - Single Mix,Color Me Badd,https://www.last.fm/music/Color+Me+Badd,"90s, 1991, Soundtrack, new jack swing, I wanna Sex You Up",,https://www.last.fm/music/Color+Me+Badd/_/I+Wanna+Sex+You+Up+-+Single+Mix
7866c9a0-d191-35be-b9d6-4f93e9794d3b,U Send Me Swingin',Mint Condition,https://www.last.fm/music/Mint+Condition,"Mint Condition, rnb, soul, slow jams, 90s",,https://www.last.fm/music/Mint+Condition/_/U+Send+Me+Swingin%27
d21bc558-7985-446c-9ae5-baab147637dd,The Distance,Cake,https://www.last.fm/music/Cake,"alternative, rock, 90s, alternative rock, Cake",,https://www.last.fm/music/Cake/_/The+Distance
37177840-c453-4802-8d3d-0d887208b6b4,Daughters Of The Kaos,Luscious Jackson,https://www.last.fm/music/Luscious+Jackson,"Hip-Hop, rock, alternative, female vocalists, Grand Royal",,https://www.last.fm/music/Luscious+Jackson/_/Daughters+Of+The+Kaos
60631778-1829-48c3-8752-701240b7f01f,Judith,A Perfect Circle,https://www.last.fm/music/A+Perfect+Circle,"alternative rock, Progressive rock, rock, alternative, A Perfect Circle",,https://www.last.fm/music/A+Perfect+Circle/_/Judith
74e5f2e6-d6c3-31a7-9391-e0c997a3931b,Eteins La Lumière,Axel Bauer,https://www.last.fm/music/Axel+Bauer,"french, rock, francais, herz, france8090",,https://www.last.fm/music/Axel+Bauer/_/Eteins+La+Lumi%C3%A8re
01ff6f89-6e78-3736-9ec5-650390c791d9,Kiss Them for Me,Siouxsie and the Banshees,https://www.last.fm/music/Siouxsie+and+the+Banshees,"post-punk, new wave, 80s, alternative, female vocalists",,https://www.last.fm/music/Siouxsie+and+the+Banshees/_/Kiss+Them+for+Me
29cb3600-5038-4616-a063-77d3d958e3a0,Cargo,Axel Bauer,https://www.last.fm/music/Axel+Bauer,"fip, french, 80s, french pop, 80s Pop",,https://www.last.fm/music/Axel+Bauer/_/Cargo
087ddfe4-29e0-32d9-8325-966fcdadbc9f,United States of Whatever,Liam Lynch,https://www.last.fm/music/Liam+Lynch,"rock, comedy, punk, funny, alternative",,https://www.last.fm/music/Liam+Lynch/_/United+States+of+Whatever
6242d5f8-7bff-303b-b6cc-b33ba28e2caa,Searching for the space monkey,Chinese Man,https://www.last.fm/music/Chinese+Man,"trip-hop, beautiful, Good-stuff, jointmusic",,https://www.last.fm/music/Chinese+Man/_/Searching+for+the+space+monkey
0451c277-9cf3-3326-981a-6d72bc16047e,"Jumpin', Jumpin'",Destiny's Child,https://www.last.fm/music/Destiny%27s+Child,"rnb, pop, dance, female vocalists, destinys child",,"https://www.last.fm/music/Destiny%27s+Child/_/Jumpin%27,+Jumpin%27"
1dcba6e3-0ca1-4dff-8724-49f265296e3c,Au Fur et à Mesure,Liane Foly,https://www.last.fm/music/Liane+Foly,"pop, jazz live, Jazz from France, the jazz of Wiesbaden, ch4nfr41s3",,https://www.last.fm/music/Liane+Foly/_/Au+Fur+et+%C3%A0+Mesure
1c7dd854-f3d7-4f87-9096-53d6bdb9989a,Poupée Psychédélique,Thierry Hazard,https://www.last.fm/music/Thierry+Hazard,"french, chanson francaise, 80s, funny, la mode",,https://www.last.fm/music/Thierry+Hazard/_/Poup%C3%A9e+Psych%C3%A9d%C3%A9lique
dddbd8ee-e1e6-442e-ba95-db52ebe17f91,Tootsee Roll Radio Quiet Storm Mix,69 Boyz,https://www.last.fm/music/69+Boyz,,,https://www.last.fm/music/69+Boyz/_/Tootsee+Roll+Radio+Quiet+Storm+Mix
6d8fe2af-effd-3b68-8e90-6300706716f7,Fille du feu,Julien Clerc,https://www.last.fm/music/Julien+Clerc,"french, all  time  favourites",,https://www.last.fm/music/Julien+Clerc/_/Fille+du+feu
06bfa92d-e9f7-4a7e-93a6-7cc938a17516,Superhero,Jane's Addiction,https://www.last.fm/music/Jane%27s+Addiction,"alternative rock, Entourage, rock, Soundtrack, hard rock",,https://www.last.fm/music/Jane%27s+Addiction/_/Superhero
01bd0519-4b13-4f88-a9a5-52f87abbe6e7,For Tonight You're Only Here to Know,The Distillers,https://www.last.fm/music/The+Distillers,"punk, punk rock, female vocalists, female vocalist, rock",,https://www.last.fm/music/The+Distillers/_/For+Tonight+You%27re+Only+Here+to+Know
63a2d3cd-ab38-41f4-b343-559dd09e42cb,Worry with you,Sleater-Kinney,https://www.last.fm/music/Sleater-Kinney,fip,,https://www.last.fm/music/Sleater-Kinney/_/Worry+with+you
0c831d5a-a4f3-34d8-8362-72afb007f1b2,Crazy Love,Gruntruck,https://www.last.fm/music/Gruntruck,"Grunge, 90s, alternative metal, heavy metal, metal",,https://www.last.fm/music/Gruntruck/_/Crazy+Love
142f3037-25fe-33b5-8ff4-32edc9784d28,Wake Up,Mad Season,https://www.last.fm/music/Mad+Season,"Grunge, alternative rock, rock, seattle, 90s",,https://www.last.fm/music/Mad+Season/_/Wake+Up
04e24d8b-a891-4cd8-a511-da99e656e9d2,Say Hello 2 Heaven,Temple of the Dog,https://www.last.fm/music/Temple+of+the+Dog,"Grunge, rock, 90s, alternative, alternative rock",,https://www.last.fm/music/Temple+of+the+Dog/_/Say+Hello+2+Heaven
59a77def-e56f-3c35-b763-08c7f9b1d15d,True Nature,Jane's Addiction,https://www.last.fm/music/Jane%27s+Addiction,"alternative rock, rock, alternative, hard rock, Grunge",,https://www.last.fm/music/Jane%27s+Addiction/_/True+Nature
900176e5-0113-432b-9cb8-7686b7179afc,My Song,Jerry Cantrell,https://www.last.fm/music/Jerry+Cantrell,"Grunge, rock, Jerry Cantrell, alternative, alternative rock",,https://www.last.fm/music/Jerry+Cantrell/_/My+Song
19d79f90-9a2d-4b28-90f8-5ad096ec90df,"Less Teeth, More Tits",Lunachicks,https://www.last.fm/music/Lunachicks,"punk, riot grrrl, political, grrrl, rock",,"https://www.last.fm/music/Lunachicks/_/Less+Teeth,+More+Tits"
15ab3d95-61b2-4ee7-acb8-c803c850554f,I'm Above,Mad Season,https://www.last.fm/music/Mad+Season,"Grunge, rock, alternative rock, alternative, seattle",,https://www.last.fm/music/Mad+Season/_/I%27m+Above
3f573a25-9e74-4b71-a7a3-b6d1ecad7d37,White Boy,Bikini Kill,https://www.last.fm/music/Bikini+Kill,"riot grrrl, punk, female vocalists, angry, angry girl songs",,https://www.last.fm/music/Bikini+Kill/_/White+Boy
00c083ac-97c0-4a3a-80ab-bbe16bf0ef52,Four Walled World,Temple of the Dog,https://www.last.fm/music/Temple+of+the+Dog,"Grunge, alternative rock, rock, alternative, hard rock",,https://www.last.fm/music/Temple+of+the+Dog/_/Four+Walled+World
06acba00-66ba-4bd8-829f-0246cb606d38,Reasons To Be Beautiful,Hole,https://www.last.fm/music/Hole,"Grunge, rock, 90s, alternative rock, alternative",,https://www.last.fm/music/Hole/_/Reasons+To+Be+Beautiful
20d56ec5-f2d3-418e-a044-9b43d12af5f9,Bluebell,Babes in Toyland,https://www.last.fm/music/Babes+in+Toyland,"punk, Grunge, riot grrrl, rock, alternative",,https://www.last.fm/music/Babes+in+Toyland/_/Bluebell
bfad4981-a617-340b-8174-d3e3d669e681,Fear of Dying,Jack Off Jill,https://www.last.fm/music/Jack+Off+Jill,"rock, female vocalists, alternative, alternative rock, angry",,https://www.last.fm/music/Jack+Off+Jill/_/Fear+of+Dying
149c4307-0a82-4cb1-8e3f-2488ea31c3ca,November Hotel,Mad Season,https://www.last.fm/music/Mad+Season,"Grunge, instrumental, rock, alternative rock, mad season",,https://www.last.fm/music/Mad+Season/_/November+Hotel
112ea75a-5dd2-30da-8a25-d8c73676d514,Ocean Size,Jane's Addiction,https://www.last.fm/music/Jane%27s+Addiction,"rock, alternative rock, alternative, 90s, janes addiction",,https://www.last.fm/music/Jane%27s+Addiction/_/Ocean+Size
157d3f93-7d27-48f9-80a9-80190fc12dd6,Chloe Dancer/Crown of Thorns,Mother Love Bone,https://www.last.fm/music/Mother+Love+Bone,"Grunge, rock, alternative rock, seattle, Mother Love Bone",,https://www.last.fm/music/Mother+Love+Bone/_/Chloe+Dancer%2FCrown+of+Thorns
14e2a6bd-5b89-4f91-8a5d-03d3d92e49f7,Someone Else's Bed,Hole,https://www.last.fm/music/Hole,"rock, Grunge, alternative rock, hole, female vocalists",,https://www.last.fm/music/Hole/_/Someone+Else%27s+Bed
35e55f49-520c-4a6a-a54c-7f338367cfd3,Dead Men Don't Rape,7 Year Bitch,https://www.last.fm/music/7+Year+Bitch,"riot grrrl, Grunge, female vocalists, rock, punk",,https://www.last.fm/music/7+Year+Bitch/_/Dead+Men+Don%27t+Rape
aefc5ee4-a18c-4b5e-bc96-ef0c4dbb6ec3,Milktoast,Helmet,https://www.last.fm/music/Helmet,"Soundtrack, alternative, the crow, metal, rock",,https://www.last.fm/music/Helmet/_/Milktoast
128c4f80-fbcf-3458-8963-586d0eba59fd,Up the Beach,Jane's Addiction,https://www.last.fm/music/Jane%27s+Addiction,"rock, alternative rock, alternative, 90s, 80s",,https://www.last.fm/music/Jane%27s+Addiction/_/Up+the+Beach
a7b063f1-63ce-4850-ad7a-273d8f3ba3d2,Shirley,L7,https://www.last.fm/music/L7,"Grunge, punk, riot grrrl, rock, punk rock",,https://www.last.fm/music/L7/_/Shirley
f0529654-0025-399b-bdcd-3062c235637c,Dracula From Houston,Butthole Surfers,https://www.last.fm/music/Butthole+Surfers,"scrubs, alternative, rock, Soundtrack, punk",,https://www.last.fm/music/Butthole+Surfers/_/Dracula+From+Houston
00b494d7-f4e1-327b-82e6-744ac7974e47,Teenage Whore,Hole,https://www.last.fm/music/Hole,"Grunge, riot grrrl, rock, alternative, 90s",,https://www.last.fm/music/Hole/_/Teenage+Whore
04781037-b7e0-3a3f-9eda-ffc861b73ab2,X-Ray Mind,Mad Season,https://www.last.fm/music/Mad+Season,"Grunge, alternative rock, rock, mad season, seattle",,https://www.last.fm/music/Mad+Season/_/X-Ray+Mind
16e28ca2-8d84-4ca5-8ece-5831868832f2,Cut You In,Jerry Cantrell,https://www.last.fm/music/Jerry+Cantrell,"Grunge, rock, 90s, Jerry Cantrell, alternative",,https://www.last.fm/music/Jerry+Cantrell/_/Cut+You+In
0ca4b07c-4e4a-3eb8-a3c4-5d56f2eec0bc,Hall of Mirrors,The Distillers,https://www.last.fm/music/The+Distillers,"punk, punk rock, female vocalists, female vocalist, rock",,https://www.last.fm/music/The+Distillers/_/Hall+of+Mirrors
0a717dd7-f24f-3a3a-b3d6-f20ab58008d6,Bite the Wax Tadpole,L7,https://www.last.fm/music/L7,"Grunge, riot grrrl, female vocalists, punk rock, 90s",,https://www.last.fm/music/L7/_/Bite+the+Wax+Tadpole
b10e5dec-743d-3eb4-ad53-713c4ef18f18,Cough Syrup,Butthole Surfers,https://www.last.fm/music/Butthole+Surfers,"alternative, alternative rock, rock, 90s, punk",,https://www.last.fm/music/Butthole+Surfers/_/Cough+Syrup
